timestamp,url,variant,status,before_title,after_title,before_metadesc,after_metadesc,before_focus_kw,after_focus_kw
2026-06-01T07:33:10.451973,que-hacer-manta-ecuador-guia-turistica,A,NOT PERSISTED,Qué Hacer en Manta Ecuador | Guía Turística 2026,Qué hacer en Manta: 17 planes reales contados por quien vive aquí,"Guía completa sobre qué hacer en Manta Ecuador. Playas, gastronomía, turismo y vida nocturna. Descubre los mejores planes en la capital atunera.","Reúne los 17 planes que recomendamos a quien nos visita: playas, comida manabita, vida nocturna y un rooftop con vista al Pacífico.",qué hacer en Manta Ecuador,que hacer en manta
2026-06-01T07:33:47.672553,gastronomia-manabi-costa-ecuatoriana,A,NOT PERSISTED,Gastronomía de Manabí | Platos de la Costa Ecuatoriana,Gastronomía manabita: 12 platos que probar antes de irte de Manta,"La gastronomía de Manabí es la más rica de la costa ecuatoriana. Conoce los platos tradicionales, ingredientes y dónde disfrutarla.","Desde el viche hasta el corviche: los 12 platos que el equipo de Luuma recomienda probar en Manta, con dónde encontrarlos y por qué nos importan.",gastronomía manabí,gastronomía manabita
2026-06-01T07:34:24.999314,vida-nocturna-manta,A,NOT PERSISTED,"Vida Nocturna en Manta | Bares, Rooftops y Fiestas","Vida nocturna en Manta: jueves, viernes y sábado (lo que hacemos los locales)","Guía de la vida nocturna en Manta. Los mejores bares, rooftops, discotecas y lugares para salir de noche en la costa ecuatoriana.","Salir en Manta entre semana es distinto al fin de semana. Te contamos por barrio qué abre, qué cuesta y por dónde empezamos los que vivimos aquí.",vida nocturna manta,vida nocturna manta
2026-06-01T07:35:03.473975,eventos-musica-vivo-manta-agenda,A,NOT PERSISTED,Música en Vivo en Manta | Eventos y Agenda 2026,Música en vivo en Manta: agenda actualizada (mes en curso) 2026,Eventos con música en vivo en Manta. Agenda cultural 2026 con artistas locales y tributos. Disfruta la mejor música en Luuma Rooftop.,"Agenda de música en vivo en Manta actualizada: bandas, horarios y dónde verlos. Incluye nuestra programación en el rooftop de Luuma.",música en vivo en Manta,música en vivo manta
2026-06-01T07:35:39.158626,menu-ejecutivo-manta-almorzar,A,NOT PERSISTED,Menú Ejecutivo en Manta | Dónde Almorzar Bien 2026,Almuerzo ejecutivo en Manta: dónde almuerzan los mantenses ($6–$18),Mejores opciones de menú ejecutivo en Manta. Almuerza bien y a buen precio con 10% de descuento en Luuma Rooftop de 11h00 a 16h00.,Comparativa real de menús ejecutivos en Manta por zona y precio. De $6 en Tarqui a $18 en Flavio Reyes con vista al mar.,menú ejecutivo en Manta,almuerzo ejecutivo manta
2026-06-01T07:36:15.276270,mejores-restaurantes-manta-ecuador,A,NOT PERSISTED,Mejores Restaurantes en Manta Ecuador | Guía 2026,Los 11 mejores restaurantes de Manta según el equipo de Luuma,Descubre los 10 mejores restaurantes en Manta Ecuador para 2026. Desde rooftops con vista al mar hasta ceviches tradicionales. Guía gastronómica completa.,"Lista honesta de los 11 restaurantes de Manta que recomendamos a quien nos visita. Sí, nos incluimos al final (te explicamos por qué).",restaurantes en Manta Ecuador,mejores restaurantes manta
2026-06-01T07:36:50.935166,menu,A,NOT PERSISTED,,Carta de Luuma Rooftop: cocina manabita y cocteles de autor,,"Carta completa de Luuma Rooftop en Manta: entradas, fuertes manabitas, mariscos del Pacífico y cocteles de autor. Av. Flavio Reyes.",,luuma menu
2026-06-01T07:37:27.023934,,A,NOT PERSISTED,,"Luuma Rooftop Manta: cocina manabita y mixología, av. Flavio Reyes",,"Rooftop en Manta con cocina manabita contemporánea y mixología de autor. Reservas en av. Flavio Reyes, con vista al Pacífico.",,luuma rooftop manta
